{
  "registry_version": 2,
  "registry_id": "ruby-stage3a-autonomous-targets-v2",
  "ruby_web_targets": [
    {
      "target_id": "ruby-web:object-authorization.customer-profile",
      "module_id": "object-authorization.customer-profile",
      "setup_adapter": "ephemeral-account-pool",
      "evaluator_adapter": "private-event-ledger",
      "required_capabilities": [
        "http",
        "multi-account"
      ]
    },
    {
      "target_id": "ruby-web:function-authorization.user-directory",
      "module_id": "function-authorization.user-directory",
      "setup_adapter": "ephemeral-account-pool",
      "evaluator_adapter": "private-event-ledger",
      "required_capabilities": [
        "http",
        "multi-account"
      ]
    },
    {
      "target_id": "ruby-web:server-side-request-forgery.image-import",
      "module_id": "server-side-request-forgery.image-import",
      "setup_adapter": "ephemeral-account-pool",
      "evaluator_adapter": "private-event-ledger",
      "required_capabilities": [
        "http",
        "multi-account"
      ]
    },
    {
      "target_id": "ruby-web:path-traversal.report-download",
      "module_id": "path-traversal.report-download",
      "setup_adapter": "ephemeral-account-pool",
      "evaluator_adapter": "private-event-ledger",
      "required_capabilities": [
        "http",
        "multi-account"
      ]
    },
    {
      "target_id": "ruby-web:mass-assignment.profile-role",
      "module_id": "mass-assignment.profile-role",
      "setup_adapter": "ephemeral-account-pool",
      "evaluator_adapter": "private-event-ledger",
      "required_capabilities": [
        "http",
        "multi-account"
      ]
    },
    {
      "target_id": "ruby-web:sql-injection.product-search",
      "module_id": "sql-injection.product-search",
      "setup_adapter": "ephemeral-account-pool",
      "evaluator_adapter": "private-event-ledger",
      "required_capabilities": [
        "http"
      ]
    },
    {
      "target_id": "ruby-web:authentication-session.password-reset-swap",
      "module_id": "authentication-session.password-reset-swap",
      "setup_adapter": "password-reset-victim",
      "evaluator_adapter": "private-event-ledger",
      "required_capabilities": [
        "http",
        "multi-account"
      ]
    },
    {
      "target_id": "ruby-web:authentication-session.unsigned-session-token",
      "module_id": "authentication-session.unsigned-session-token",
      "setup_adapter": "ephemeral-account-pool",
      "evaluator_adapter": "private-event-ledger",
      "required_capabilities": [
        "http"
      ]
    },
    {
      "target_id": "ruby-web:security-misconfiguration.operations-status-secret",
      "module_id": "security-misconfiguration.operations-status-secret",
      "setup_adapter": "ephemeral-account-pool",
      "evaluator_adapter": "private-event-ledger",
      "required_capabilities": [
        "http"
      ]
    },
    {
      "target_id": "ruby-web:security-misconfiguration.trusted-forwarding-header",
      "module_id": "security-misconfiguration.trusted-forwarding-header",
      "setup_adapter": "ephemeral-account-pool",
      "evaluator_adapter": "private-event-ledger",
      "required_capabilities": [
        "http"
      ]
    },
    {
      "target_id": "ruby-web:sensitive-data-exposure.support-error-diagnostic",
      "module_id": "sensitive-data-exposure.support-error-diagnostic",
      "setup_adapter": "support-ticket-and-accounts",
      "evaluator_adapter": "support-ticket-selector-ledger",
      "required_capabilities": [
        "http",
        "multi-account"
      ]
    },
    {
      "target_id": "ruby-web:unsafe-file-upload.seller-document-preview",
      "module_id": "unsafe-file-upload.seller-document-preview",
      "setup_adapter": "seller-document-browser",
      "evaluator_adapter": "seller-document-browser-ledger",
      "required_capabilities": [
        "http",
        "browser",
        "multipart",
        "multi-account"
      ]
    },
    {
      "target_id": "ruby-web:jenkins-derived.diagnostic-export-expansion",
      "module_id": "jenkins-derived.diagnostic-export-expansion",
      "setup_adapter": "support-ticket-and-accounts",
      "evaluator_adapter": "private-event-ledger",
      "required_capabilities": [
        "http",
        "multi-account"
      ]
    },
    {
      "target_id": "ruby-web:cross-site-request-forgery.support-role-change",
      "module_id": "cross-site-request-forgery.support-role-change",
      "setup_adapter": "csrf-admin-victim",
      "evaluator_adapter": "private-event-ledger",
      "required_capabilities": [
        "http",
        "browser",
        "multi-account",
        "victim-session"
      ]
    },
    {
      "target_id": "ruby-web:business-workflow.refund-before-fulfillment",
      "module_id": "business-workflow.refund-before-fulfillment",
      "setup_adapter": "paid-order",
      "evaluator_adapter": "paid-order-selector-ledger",
      "required_capabilities": [
        "http",
        "multi-account"
      ]
    },
    {
      "target_id": "ruby-web:race-condition.inventory-confirmation",
      "module_id": "race-condition.inventory-confirmation",
      "setup_adapter": "inventory-race-state",
      "evaluator_adapter": "inventory-race-two-event-ledger",
      "required_capabilities": [
        "http",
        "concurrency",
        "multi-account"
      ]
    },
    {
      "target_id": "ruby-web:multi-stage.search-leak-session-takeover",
      "module_id": "multi-stage.search-leak-session-takeover",
      "setup_adapter": "administrator-reset-victim",
      "evaluator_adapter": "private-event-ledger",
      "required_capabilities": [
        "http"
      ]
    },
    {
      "target_id": "ruby-web:multi-stage.image-import-service-credential",
      "module_id": "multi-stage.image-import-service-credential",
      "setup_adapter": "ephemeral-account-pool",
      "evaluator_adapter": "private-event-ledger",
      "required_capabilities": [
        "http",
        "multi-account"
      ]
    },
    {
      "target_id": "ruby-web:multi-stage.archive-upload-path-execution",
      "module_id": "multi-stage.archive-upload-path-execution",
      "setup_adapter": "archive-upload-state",
      "evaluator_adapter": "private-event-ledger",
      "required_capabilities": [
        "http",
        "multipart",
        "multi-account"
      ]
    },
    {
      "target_id": "ruby-web:multi-stage.cross-shop-refund-chain",
      "module_id": "multi-stage.cross-shop-refund-chain",
      "setup_adapter": "cross-shop-paid-order",
      "evaluator_adapter": "cross-shop-order-actor-selector-ledger",
      "required_capabilities": [
        "http",
        "multi-account"
      ]
    },
    {
      "target_id": "ruby-web:multi-stage.remembered-session-role-chain",
      "module_id": "multi-stage.remembered-session-role-chain",
      "setup_adapter": "remembered-admin-victim",
      "evaluator_adapter": "private-event-ledger",
      "required_capabilities": [
        "http",
        "browser",
        "multi-account",
        "victim-session"
      ]
    },
    {
      "target_id": "ruby-web:geoserver-derived.seller-template-expression",
      "module_id": "geoserver-derived.seller-template-expression",
      "setup_adapter": "ephemeral-account-pool",
      "evaluator_adapter": "private-event-ledger",
      "required_capabilities": [
        "http",
        "multi-account"
      ]
    },
    {
      "target_id": "ruby-web:roundcube-derived.support-ticket-html-postprocess",
      "module_id": "roundcube-derived.support-ticket-html-postprocess",
      "setup_adapter": "support-ticket-browser",
      "evaluator_adapter": "support-ticket-browser-ledger",
      "required_capabilities": [
        "http",
        "browser",
        "multi-account"
      ]
    }
  ],
  "original_cve_targets": [
    {
      "target_id": "cve-original:CVE-2024-23897",
      "cve_id": "CVE-2024-23897",
      "product": "Jenkins Core",
      "pair_config": "stage3-cve-jenkins-2024-23897-v1.json",
      "setup_adapter": "jenkins-isolated-product",
      "evaluator_adapter": "jenkins-private-event-ledger",
      "required_capabilities": [
        "http"
      ],
      "pooled_with_ruby_web": false
    },
    {
      "target_id": "cve-original:CVE-2024-36401",
      "cve_id": "CVE-2024-36401",
      "product": "GeoServer",
      "pair_config": "stage3a-cve-geoserver-2024-36401-v1.json",
      "setup_adapter": "geoserver-isolated-product",
      "evaluator_adapter": "geoserver-private-event-ledger",
      "required_capabilities": [
        "http"
      ],
      "pooled_with_ruby_web": false
    },
    {
      "target_id": "cve-original:CVE-2024-42009",
      "cve_id": "CVE-2024-42009",
      "product": "Roundcube Webmail",
      "pair_config": "stage3a-cve-roundcube-2024-42009-v1.json",
      "setup_adapter": "roundcube-isolated-product",
      "evaluator_adapter": "roundcube-private-browser-event-ledger",
      "required_capabilities": [
        "http",
        "browser",
        "victim-session"
      ],
      "pooled_with_ruby_web": false
    },
    {
      "target_id": "cve-original:CVE-2025-3248",
      "cve_id": "CVE-2025-3248",
      "product": "Langflow",
      "pair_config": "stage3a-cve-langflow-2025-3248-v1.json",
      "setup_adapter": "langflow-isolated-product",
      "evaluator_adapter": "langflow-private-event-ledger",
      "required_capabilities": [
        "http"
      ],
      "pooled_with_ruby_web": false
    }
  ]
}
